fine_label	utterance
UNK:UNK	Ina, quantas vezes você acha que Jeff deseja receber esta mensagem? Por favor, ajude Phillip Encaminhado por Phillip K Allen/HOU/ECT em 08/08/2000 16:30 ----- De: Jeffrey A Shankman 08/08/2000 05:59 Para: Phillip K Allen/HOU/ECT @ECT cc: Paul T Lucci/DEN/ECT@Enron Assunto: Sua aprovação está atrasada: Solicitação de acesso para paul.t.lucci@enron.com Peça que Phillip ou John L aprovem. obrigado. Jeff Encaminhado por Jeffrey A Shankman/HOU/ECT em 08/08/2000 07:48 ----- ARSystem@ect.enron.com em 07/08/2000 19:03:23 Para: jeffrey.a. shankman@enron.com cc: Assunto: Sua aprovação está atrasada: Solicitação de acesso para paul.t.lucci@enron.com Esta solicitação está aguardando sua aprovação há 8 dias. Clique em http://itcApps.corp.enron.com/srrs/Approve/Detail.asp?ID=00000000000935&Email =jeffrey.a.shankman@enron.com para aprovar a solicitação ou entre em contato com o IRM pelo telefone 713-853-5536 se você tiver algum problema. ID da solicitação: 000000000000935 Data de criação da solicitação: 27/07/00 14:15:23 Solicitado para: paul.t.lucci@enron.com Nome do recurso: EOL US NatGas US GAS PHY FWD FIRM Non-Texas <ou = 1 mês Tipo de recurso: aplicativos
UNK:UNK	Ina, continuo recebendo solicitações de segurança que não consigo aprovar. Por favor, cuide disso. Phillip Encaminhado por Phillip K Allen/HOU/ECT em 08/08/2000 16:28 ----- ARSystem@ect.enron.com em 08/08/2000 07:17:38 Para: phillip.k. allen@enron.com cc: Assunto: Solicitação enviada: Solicitação de acesso para frank.ermis@enron.com Revise e atue de acordo com esta solicitação. Você recebeu este e-mail porque o solicitante especificou você como gerente. Por favor, clique em http://itcApps.corp.enron.com/srrs/Approve/Detail.asp?ID=000000000001282&Email =phillip.k.allen@enron.com para aprovar o ID da solicitação: 000000000001282 Data de criação da solicitação: 8/8/ 00 9:15:59 Solicitado para: frank.ermis@enron.com Nome do recurso: Dados de mercado Telerate Tipo de recurso de energia básica: Aplicativos
UNK:UNK	Quais são suas habilidades? Por que você quer estar em uma mesa de negociação?
UNK:UNK	Encaminhado por Phillip K Allen/HOU/ECT em 07/08/2000 12h42 ----- De: Jay Reitmeyer 07/08/2000 10h39 Para: Phillip K Allen/HOU/ECT@ECT, Keith Holst/HOU/ECT@ect cc: Assunto: Novas Curvas Socais
UNK:UNK	Lucy, não recebi um fax com o extrato bancário de julho na sexta-feira. Você pode enviá-lo por fax para 713 646 2391 Phillip
UNK:UNK	Equipe de migração do Outlook@ENRON 11/05/2001 13h49 Para:=09Cheryl Wilchynski/HR/Corp/Enron@ENRON, Cindy R Ward/NA/Enron@ENRON, J= o Ann Hill/Corp/Enron@ENRON, Sonja Galloway/Corp/Enron@Enron, Bilal Bajwa/N= A/Enron@Enron, Binh Pham/HOU/ECT@ECT, Bradley Jones/ENRON@enronXgate, Bruce= Mills/Corp/Enron@ENRON, Chance Rabon/ENRON @enronXgate, Chuck Ames/NA/Enron= @Enron, David Baumbach/HOU/ECT@ECT, Jad Doan/ENRON@enronXgate, ONeal D Win= grátis/HOU/ECT@ECT, Phillip M Love/HOU/ECT@ECT , Sladana-Anna Kulic/ENRON@enro= nXgate, Victor Guggenheim/HOU/ECT@ECT, Alejandra Chavez/NA/Enron@ENRON, Ann= e Bike/Enron@EnronXGate, Carole Frank/NA/Enron@ENRON, Darron C Giron/HOU/EC= T@ECT, Elizabeth L Hernandez/HOU/ECT@ECT, Elizabeth Shim/Corp/Enron@ENRON, = Jeff Royed/Corp/Enron@ENRON, Kam Keiser/HOU/ECT@ECT, Kimat Singla /HOU/ECT@E= CT, Kristen Clause/ENRON@enronXgate, Kulvinder Fowler/NA/Enron@ENRON, Kyle = R Lilly/HOU/ECT@ECT, Luchas Johnson/NA/Enron@Enron, Maria Garza/HOU/ ECT@ECT= , Patrick Ryder/NA/Enron@Enron, Ryan ORourke/ENRON@enronXgate, Yuan Tian/N= A/Enron@ENRON, Frank Ermis/HOU/ECT@ECT, Jane M Tholt/HOU/ECT@ECT , Jay Reitm= eyer/HOU/ECT@ECT, Keith Holst/HOU/ECT@ect, Matthew Lenhart/HOU/ECT@ECT, Mik= e Grigsby/HOU/ECT@ECT, Monique Sanchez/HOU/ECT@ECT, Phillip K Allen/HOU/ECT= @ECT, Randall L Gay/HOU/ECT@ECT, Tori Kuykendall/HOU/ECT@ECT, Ina Norman/HO= U/ECT@ECT, Jackie Travis/HOU/ECT@ECT, Michael J Gasper/HOU/ECT@ECT, Brenda = H Fletcher/HOU/ECT@ECT, Jeanne Wukasch/Corp/Enron@ENRON, Mary Theresa Frank=lin/HOU/ECT@ECT, Mike Potter/NA/Enron@Enron , Natalie Baker/HOU/ECT@ECT, Suz= anne Calcagno/NA/Enron@Enron, Albert Stromquist/Corp/Enron@ENRON, Rajesh Ch= ettiar/ENRON_DEVELOPMENT@ENRON_DEVELOPMENT, Derek Anderson/HOU/ECT@ECT, Bra= d Horn/HOU/ECT@ECT, Camille Gerard/Corp/Enron@ENRON, Cathy Lira/NA/Enron@EN= RON, Daniel Castagnola/ENRON_DEVELOPMENT@ENRON_DEVELOPMENT, Eva Tow/Corp/En= ron@ENRON, Lam Nguyen/ NA/Enron@Enron, Andy Pace/NA/Enron@Enron, Anna Santuc= ci/NA/Enron@Enron, Claudia Guerra/NA/Enron@ENRON, Clayton Vernon/Corp/Enron= @ENRON, David Ryan/Corp/ Enron@ENRON, Eric Smith/Empreiteiro/Enron Communicat= ions@Enron Communications, Grace Kim/NA/Enron@Enron, Jason Kaniss/ENRON@enr= onXgate, Kevin Cline/Corp/Enron@Enron, Rika Imai/NA/Enron @Enron, Todd DeCoo= k/Corp/Enron@Enron, Beth Jensen/NPNG/Enron@ENRON, Billi Harrill/NPNG/Enron@= ENRON, Martha Sumner-Kenney/NPNG/Enron@ENRON, Phyllis Miller/NPNG/Enron @ENR= ON, Sandy Olofson/NPNG/Enron@ENRON, Theresa Byrne/NPNG/Enron@ENRON, Danny M= cCarty/ET&S/Enron@Enron, Denis Tu/FGT/Enron@ENRON, John A Ayres/FGT/Enron @E= NRON, John Millar/FGT/Enron@Enron, Julie Armstrong/Corp/Enron@ENRON, Maggie= Schroeder/FGT/Enron@ENRON, Max Brown/OTS/Enron@ENRON, Randy Cantrell/GCO/E= nron @ENRON, Tracy Scott/Corp/Enron@ENRON, Charles T Muzzy/HOU/ECT@ECT, Cora= Pendergrass/Corp/Enron@ENRON, Darren Espey/Corp/Enron@ENRON, Jessica White= /NA/Enron@Enron , Kevin Brady/NA/Enron@Enron, Kirk Lenart/HOU/ECT@ECT, Lisa = Kinsey/HOU/ECT@ECT, Margie Straight/HOU/ECT@ECT, Mark L Schrab/HOU/ECT@ECT,= Souad Mahmassani/Corp/Enron@ENRON, Tammy Gilmore/NA/Enron@ENRON, Teresa Mc= Omber/NA/Enron@ENRON, Wes Dempsey/NA/Enron@Enron, Barry Feldman/NYC/MGUSA@M= GUSA, Catherine Huynh /NA/Enron@Enron cc:=09=20 Assunto:=092- PESQUISA/E-MAIL DE INFORMAÇÕES 5-14- 01 Usuário atual do Notes:=20 Para garantir uma migração bem-sucedida do Notes para o Outlook,= é necessário reúna informações individuais do usuário antes da data de migração. Por favor, reserve alguns minutos para preencher completamente a pesquisa a seguir. Clique duas vezes no documento para colocá-lo no modo de edição. Quando terminar, basta clicar no botão Responder com histórico e clicar em Enviar. Seu su=rvey será enviado automaticamente para a caixa de correio de migração do Outlook 2000. Obrigado. Equipe de migração do Outlook 2000 ---------= --------------------- Nome completo: Phillip Allen=09=09 ID de login: =09pallen Extensão : =0937041 Local do escritório: EB3210C Que tipo de computador você possui? (Desktop, Laptop, Ambos) =09Ambos Você tem um PDA? Se sim, que tipo você possui: (Nenhum, IPAQ, Palm Pilo= t, Jornada) IPAQ Você tem permissão para acessar o Email/Calendário de qualquer pessoa? =09 Se sim, quem? =20 Alguém tem permissão para acessar seu e-mail/calendário? =09Sim, Ina Ran= gel Se sim, quem? =20 Você é responsável por atualizar a agenda de endereços de alguém? =09 Se sim, quem? =20 Alguém mais é responsável pela atualização do seu catálogo de endereços? =20 Se sim, quem? =20 Você tem acesso a um calendário compartilhado? =20 Se sim, qual calendário compartilhado? =20 Você tem algum Grupo de Distribuição que o Messaging mantém para você (para correspondências m=ass)? =20 Se sim, liste aqui: =20 Liste todos os aplicativos de bancos de dados do Notes que você usa atualmente: =20 Em nossos esforços para planejar a data/hora exata de sua migração, também precisaremos = saber: Quais são seus valores normais horas de trabalho? De: 7 a: 5 Você estará fora do escritório em um futuro próximo para férias, licença, etc.? Se sim, quando? De (MM/DD/AA): Até (MM/DD/AA): =20
UNK:UNK	Envie para Karen Buckley. Entrevista sobre acompanhamento de negociação a ser realizada em maio.
UNK:UNK	Encaminhado por Phillip K Allen/HOU/ECT em 07/08/2000 07h05 ----- Chris Gaskill@ENRON 04/08/2000 15h13 Para: John J Lavorato/Corp/Enron@Enron, Phillip K Allen/HOU/ECT@ECT, Scott Neal/HOU/ECT@ECT, Thomas A Martin/HOU/ECT@ECT cc: Hunter S Shively/HOU/ECT@ECT Assunto: Site de desenvolvimento de fundamentos de gás Em anexo está o link para o site que analisamos na reunião de hoje. O site é um trabalho em andamento, então encaminhe seus comentários. http://gasfundy.dev.corp.enron.com/ Chris
UNK:UNK	Hunter, você está vigiando Alberto? Você tem o Yahoo Messenger ou o Hear Me ativado? Filipe
UNK:UNK	você pode construir algo para observar os preços históricos de onde salvamos as curvas todas as noites. Aqui está um exemplo que extrai apenas redes sociais. As melhorias podem incluir um menu suspenso para escolher qualquer curva e uma escolha de índice, gd ou nossas curvas.
UNK:UNK	John, O único acordo de longo prazo no Ocidente contra o qual você poderia usar prudência é o transporte PGT até 2023 Phillip
UNK:UNK	Lucy, ligarei para você esta tarde para discutir o assunto em seu e-mail. Filipe
UNK:UNK	Encaminhado por Phillip K Allen/HOU/ECT em 26/07/2000 10h49 ----- Enron North America Corp. De: Kristian J Lande 25/07/2000 14h24 Para: Christopher F Calger/PDX /ECT@ECT, Jake Thomas/HOU/ECT@ECT, Frank W Vickers/HOU/ECT@ECT, Elliot Mainzer/PDX/ECT@ECT, Michael McDonald/SF/ECT@ECT, David Parquet/SF/ECT@ECT , Laird Dyer/SF/ECT@ECT, Jim Buerkle/PDX/ECT@ECT, Jim Gilbert/PDX/ECT@ECT, Terry W Donovan/HOU/ECT@ECT, Jeff G Slaughter/ENRON_DEVELOPMENT@ENRON_DEVELOPMENT, Tim Belden/HOU /ECT@ECT, Mike Swerzbin/HOU/ECT@ECT, Matt Motley/PDX/ECT@ECT, Robert Badeer/HOU/ECT@ECT, Sean Crandall/PDX/ECT@ECT, Diana Scholtes/HOU/ECT@ECT, Tom Alonso/PDX/ECT@ECT, Mark Fischer/PDX/ECT@ECT, Tim Heizenrader/PDX/ECT@ECT cc: Phillip K Allen/HOU/ECT@ECT Assunto: Atualização de nova geração 24/07/00
UNK:UNK	por favor adicione Mike Grigsby à distribuição
UNK:UNK	Encaminhado por Phillip K Allen/HOU/ECT em 26/07/2000 10:44 ----- Michael Etringer 26/07/2000 08:32 Para: Keith Holst/HOU/ECT@ect, Phillip K Allen/ HOU/ECT@ECT cc: Assunto: Preço para Termo Stanfield Estou enviando um acompanhamento de uma proposta que enviei ao PUD do Condado de Clark. Eles solicitaram preços a prazo para Stanfield em um volume de 17.000. Você poderia me dar uma base para o período: 00 de setembro - 31 de maio de 2006 00 de setembro - 31 de maio de 2008 Como presumo que você não mantém uma base em Stanfield, mas sim uma base em Malin ou nas Montanhas Rochosas, provavelmente faria faz sentido mostrar a base como um ajuste a um desses pontos. Além disso, qual deveria ser o spread de oferta média nesses termos. Obrigado, Mike
UNK:UNK	Wade, entendi que sua prioridade número um era lidar com a situação do seu veículo. Você precisa cuidar disso esta semana. Lucy não pode impor aos inquilinos um padrão (os veículos devem estar em ordem de circulação e com adesivos válidos) se a equipe não cumprir isso. Se você decidir comprar um caminhão pequeno e quiser me listar como empregador para fins de crédito, atestarei sua renda. Filipe
UNK:UNK	o merlin ct. o endereço ainda é bom. Não sei por que a correspondência seria devolvida.
UNK:UNK	Tim, você pode autorizar o acesso ao local de energia oeste para Keith Holtz. Ele é nosso trader no sul da Califórnia e tem um contrato de dois anos. Por outro lado, é minha imaginação ou o site da SARR reduziu sua previsão para a alta de McNary em maio. Parece que os fluxos foram reduzidos para a faixa de 130 e há menos dias perto de 170. Além disso, a segunda quinzena de abril não parece ter ocorrido como eu esperava. As saídas permaneceram em 100-110 em McNary. Você pode enviar um e-mail ou ligar com algumas informações adicionais? Obrigado, Filipe
UNK:UNK	Aqui está o primeiro rascunho de uma lista de desejos para sistemas.
UNK:UNK	Encaminhado por Phillip K Allen/HOU/ECT em 19/07/2000 10:39 ----- Skipping Stone <ss4@skpstnhouston.com> em 18/07/2000 18:06:28 Para: Energy.Professional @mailman.enron.com cc: Assunto: Recurso de informação interativa pulando pedra animação Você nos viu ultimamente? Venha ver as novidades www.skippingstone.com Energy Experts Consultoria para a Indústria Energética!
UNK:UNK	11h15 de hoje ainda funciona.
UNK:UNK	para sua informação CIG Encaminhado por Phillip K Allen/HOU/ECT em 17/07/2000 10h45 ----- Enron North America Corp. De: Rebecca W Cantrell 14/07/2000 14h31 Para: Julie A Gomez /HOU/ECT@ECT, Stephanie Miller/Corp/Enron@ENRON, Chris Meyer/HOU/ECT@ECT, Judy Townsend/HOU/ECT@ECT, Theresa Branney/HOU/ECT@ECT, Paul T Lucci/DEN/ECT @Enron, Jane M Tholt/HOU/ECT@ECT, Steven P South/HOU/ECT@ECT, Frank Ermis/HOU/ECT@ECT, Susan W Pereira/HOU/ECT@ECT, George Smith/HOU/ECT@ECT , Randall L Gay/HOU/ECT@ECT, Jim Homco/HOU/ECT@ECT, Colleen Sullivan/HOU/ECT@ECT, Hunter S Shively/HOU/ECT@ECT, Ray Hamman/HOU/EES@EES, Robert Superty /HOU/ECT@ECT, Edward Terry/HOU/ECT@ECT, Scott Neal/HOU/ECT@ECT, Tori Kuykendall/HOU/ECT@ECT, Brenda H Fletcher/HOU/ECT@ECT, Jeff Coates/HOU/EES @EES, John Hodge/Corp/Enron@ENRON, Janet Edwards/Corp/Enron@ENRON, Ruth Concannon/HOU/ECT@ECT, Sylvia A Campos/HOU/ECT@ECT, Paul Tate/HOU/EES@EES, Phillip K Allen/HOU/ECT@ECT, Victor Lamadrid/HOU/ECT@ECT, Barbara G Dillard/HOU/ECT@ECT, Gary L Payne/HOU/ECT@ECT cc: Assunto: Comentários sobre os registros de conformidade do pedido 637 Para sua informação, estão anexados comentários iniciais da ENA que serão arquivados na segunda-feira nos Arquivos de Conformidade da Ordem 637 dos gasodutos indicados. (Columbia é Columbia Gas.) Para todos os outros gasodutos da lista de prioridades, apresentamos intervenções simples.
UNK:UNK	Encaminhado por Phillip K Allen/HOU/ECT em 14/07/2000 14:00 ----- Enron North America Corp. De: Kenneth Shulklapper 14/07/2000 06:58 Para: Phillip K Allen/HOU/ ECT@ECT cc: Assunto: Produto El Paso Blanco Avg. Por favor, estenda a todos os comerciantes internos de gás o acesso ao novo produto físico GN El Paso Blanco Avg. Tori Kuykendahl e Jane Tholt devem ter acesso administrativo para gerenciar isso no EOL. Se você tiver alguma dúvida, ligue para 3-7041 Obrigado, Phillip Allen
UNK:UNK	Kay, estarei lá naquele fim de semana, mas não tenho certeza sobre o resto da família. Está tudo bem aqui. Tentarei trazer algumas fotos se não puder trazer a coisa real. Keith
UNK:UNK	Encaminhado por Phillip K Allen/HOU/ECT em 13/07/2000 10h24 ----- De: Andy Chen em 12/07/2000 14h14 Para: Michael Etringer/HOU/ECT@ECT cc: Frank W Vickers/HOU/ECT@ECT, Saji John/HOU/ECT@ECT, Phillip K Allen/HOU/ECT@ECT, John Arnold/HOU/ECT@ECT Assunto: Projeto Elvis e Cactus Open Gas Position Mike-- Aqui são as posições líquidas abertas na fronteira Socal que temos para Elvis e Cactus. Vamos tentar marcar uma teleconferência com Phillip e John para falar sobre suas ofertas no final de suas curvas. Grosso modo, estamos olhando para 3.750 MMBtu/d nominais por 14 anos, a partir de maio de 2010, no Elvis, e 3.000 MMBtu/d, no Cactus, de junho de 2004 a abril de 2022. Andy
UNK:UNK	Encaminhado por Phillip K Allen/HOU/ECT em 12/07/2000 14h18 ----- De: Jana Giovannini 11/07/2000 14h58 Para: Phillip K Allen/HOU/ECT@ECT cc: Celeste Roberts/HOU/ECT@ECT Assunto: assoc. para a mesa oeste Desculpe, não anexei o formulário. Existe um para Associados e outro para Analistas. Encaminhado por Jana Giovannini/HOU/ECT em 11/07/2000 16h57 ----- De: Jana Giovannini 11/07/2000 16h57 Para: Phillip K Allen/HOU/ECT@ECT cc: Celeste Roberts/HOU/ECT@ECT Assunto: assoc. para a mesa oeste Ei, Phillip, recebi seu bilhete da Celeste. Sou o Coordenador de Pessoal da ENA e preciso que você preencha o formulário de Avaliação de Necessidades em anexo antes que eu possa lhe enviar qualquer currículo. Além disso, você estaria interessado na nova classe? Os analistas começam com as unidades de negócios em 3 de agosto e Assoc. começar em 28 de agosto. Estamos começando a colocar os Associados e gostaríamos de ver se você tem interesse. Por favor, me avise. Assim que eu receber de volta a Avaliação de Necessidades (e você me avisar se puder esperar um mês), ficarei feliz em trazer alguns currículos para sua análise. Se você tiver alguma dúvida, por favor me avise. Obrigado. Encaminhado por Jana Giovannini/HOU/ECT em 11/07/2000 16h50 ----- De: Dolores Muzzy 11/07/2000 16h17 Para: Jana Giovannini/HOU/ECT@ECT cc: Assunto: associado. para a mesa oeste, acredito que Phillip Allen é da ENA. Dolores Encaminhado por Dolores Muzzy/HOU/ECT em 11/07/2000 16h17 ----- De: Phillip K Allen 11/07/2000 12h54 Para: Celeste Roberts/HOU/ECT@ECT cc: Assunto: assoc. para a mesa oeste Celeste, preciso de dois associados/analistas para a mesa de negociação de gás oeste. Você pode ajudar? Também deixei uma mensagem de voz para você. Filipe x37041
UNK:UNK	Encaminhado por Phillip K Allen/HOU/ECT em 11/07/2000 16h59 ----- De: Robert Badeer 11/07/2000 14h44 Para: Phillip K Allen/HOU/ECT@ECT cc: Assunto:
UNK:UNK	Encaminhado por Phillip K Allen/HOU/ECT em 11/07/2000 16h23 ----- Enron North America Corp. De: Kimberly Hillis 11/07/2000 13h16 Para: Jeffrey A Shankman/HOU/ ECT@ECT, Hunter S Shively/HOU/ECT@ECT, Phillip K Allen/HOU/ECT@ECT, Kevin M Presto/HOU/ECT@ECT, Thresa A Allen/HOU/ECT@ECT, Kristin Albrecht/HOU/ECT @ECT, Brent A Price/HOU/ECT@ECT, Steve Jackson/HOU/ECT@ECT, Beth Perlman/HOU/ECT@ECT, Sally Beck/HOU/ECT@ECT cc: Barbara Lewis/HOU/ECT@ECT, Airam Arteaga/HOU/ECT@ECT, Cherylene R Westbrook/HOU/ECT@ECT, Patti Thompson/HOU/ECT@ECT, Felicia Doan/HOU/ECT@ECT, Irena D Hogan/HOU/ECT@ECT, Ina Rangel/ HOU/ECT@ECT Assunto: Reunião de Sistemas 18/07 Observe que John Lavorato agendou uma Reunião de Sistemas para terça-feira, 18 de julho, das 14h00 às 15h00. em EB3321. Por favor, ligue para x30681 se tiver alguma dúvida. Obrigado Kim Hillis
UNK:UNK	Eu procuraria propriedades em San Antonio ou Dallas.
UNK:UNK	Celeste, preciso de dois associados/analistas para a mesa de negociação de gás oeste. Você pode ajudar? Também deixei uma mensagem de voz para você. Filipe x37041
UNK:UNK	Que tal terça-feira às 11h15 em frente ao prédio?
UNK:UNK	adicione Mike Grigsby à lista de distribuição.
UNK:UNK	testando
UNK:UNK	Encaminhado por Phillip K Allen/HOU/ECT em 11/07/2000 06h12 ----- Enron North America Corp. De: John J Lavorato 10/07/2000 16h03 Enviado por: Kimberly Hillis Para: Jeffrey A Shankman/HOU/ECT@ECT, Hunter S Shively/HOU/ECT@ECT, Phillip K Allen/HOU/ECT@ECT, Steve Jackson/HOU/ECT@ECT, Kevin M Presto/HOU/ECT@ECT, Kristin Albrecht/HOU/ECT@ECT, Thresa A Allen/HOU/ECT@ECT, Brent A Price/HOU/ECT@ECT cc: Assunto: Reunião do Sistema 7/11 Isto é para confirmar uma reunião para amanhã, terça-feira, 11 de julho às 14h00. Por favor, refira-se à reunião como Reunião de Sistemas e observe também que haverá uma reunião de acompanhamento. A reunião será realizada na EB3321. Ligue para Kim Hillis em x30681 se tiver alguma dúvida. k
UNK:UNK	Encaminhado por Phillip K Allen/HOU/ECT em 10/07/2000 16:40 ----- Scott Neal 10/07/2000 13:19 Para: Phillip K Allen/HOU/ECT@ECT, Hunter S Shively /HOU/ECT@ECT, Elsa Villarreal/HOU/ECT@ECT, Thomas A Martin/HOU/ECT@ECT cc: Assunto: Clientes de Gás Natural Encaminhado por Scott Neal/HOU/ECT em 10/07/2000 15h18 ----- Jason Moore 26/06/2000 10h44 Para: Scott Neal/HOU/ECT@ECT cc: Joel Henenberg/NA/Enron@Enron, Mary G Gosnell/HOU/ECT@ECT Assunto: Gás Natural Clientes Em anexo encontra-se uma planilha contendo uma lista de clientes de gás natural no banco de dados da Contraparte Global. Todas são contrapartes ativas, embora possamos não estar fazendo negócios com elas atualmente. Se você tiver alguma dúvida, sinta-se à vontade para me ligar no x33198. Jason Moore
UNK:UNK	Ina, por favor, inscreva-me neste curso sempre que Hunter estiver inscrito. Obrigado
UNK:UNK	Al, não estou em boa forma para andar um século agora. Além disso, estou cuidando de alguns ferimentos. Posso almoçar esta semana ou na próxima, vamos escolher um dia. Filipe
UNK:UNK	Brenda, O documento Word anexado é um formulário de aviso/consentimento para a venda. O arquivo Excel é uma tabela de amortização da nota. Você pode usar a Redução Adicional do Principal para registrar pré-pagamentos. Por favor, envie-me um e-mail de volta para confirmar o recebimento. Filipe
UNK:UNK	Jeff, falei com Brenda e tudo parece bem. Matt Lutz deveria ter me enviado um e-mail com algum idioma, mas não o recebi. Eu não tenho o número dele, então você pode acompanhar. Quando é a data estimada de fechamento. Deixe-me saber o que mais preciso fazer. Filipe
UNK:UNK	Gary, também conversei com Johnnie Brown em San Antonio para ser o empreiteiro geral. Segundo Johnnie, eu não pagaria menos comprando na fábrica do que comprando os painéis por meio dele, já que meu site fica na região dele. Supondo que isso seja verdade, trabalharei diretamente com ele. Acredito que ele lhe enviou meus planos. Foram elaborados pelos arquitetos Kipp Flores. Você pode confirmar se o preço é o mesmo direto da fábrica ou do distribuidor? Se você tiver as estimativas elaboradas para Johnnie, poderia enviá-las para mim também? Obrigado pelo seu tempo. Estou animado com a possibilidade de usar seu produto. Phillip Allen
UNK:UNK	Gary, obrigado pela informação.
UNK:UNK	A qualquer hora depois das 15h.
UNK:UNK	Tim, Matt enviou um e-mail para você tentando organizar alguns dados do cems e wscc. Tim H. expressou preocupação com a confiabilidade dos dados do wscc. Não sei se devemos descartar o wscc ou apenas continuar monitorando caso melhore. Deixe-me saber o que você pensa. Filipe
UNK:UNK	Quais são minhas escolhas para datas? Encaminhado por Phillip K Allen/HOU/ECT em 06/07/2000 15h44 ----- David W Delainey 29/06/2000 10h48 Para: Jeffery Ader/HOU/ECT@ECT, Phillip K Allen /HOU/ECT@ECT, Edward D Baughman/HOU/ECT@ECT, Tim Belden/HOU/ECT@ECT, Greg Blair/Corp/Enron@Enron, Bryan Burnett/HOU/ECT@ECT, George Carrick/HOU/ECT @ECT, Joseph Deffner/HOU/ECT@ECT, Janet R Dietrich/HOU/ECT@ECT, Craig A Fox/HOU/ECT@ECT, Julie A Gomez/HOU/ECT@ECT, Mike Jakubik/HOU/ECT@ECT , Scott Josey/Corp/Enron@ENRON, Fred Lagrasta/HOU/ECT@ECT, John J Lavorato/Corp/Enron@Enron, Thomas A Martin/HOU/ECT@ECT, Gil Muhl/Corp/Enron@ENRON, Scott Neal /HOU/ECT@ECT, Jesse Neyman/HOU/ECT@ECT, Edward Ondarza/HOU/ECT@ECT, Ozzie Pagan/HOU/ECT@ECT, Kevin M Presto/HOU/ECT@ECT, Mike A Roberts/HOU/ ECT@ECT, Jim Schwieger/HOU/ECT@ECT, Hunter S Shively/HOU/ECT@ECT, Bruce Sukaly/Corp/Enron@Enron, Colleen Sullivan/HOU/ECT@ECT, Mike Swerzbin/HOU/ECT@ECT, John Thompson/LON/ECT@ECT, Carl Tricoli/Corp/Enron@Enron, Greg Wolfe/HOU/ECT@ECT cc: Billy Lemmons/Corp/Enron@ENRON, Mark Frevert/NA/Enron@Enron Assunto: Impacto Executivo e Pessoal do Curso de Influência, vocês são os demais oficiais da ENA que ainda não se inscreveram neste programa de treinamento obrigatório. O objectivo da ENA é que todos os seus responsáveis ​​sejam aprovados no programa antes do final do ano civil de 2000. O curso recebeu notas muito altas pela sua eficácia. Reserve um tempo agora para se inscrever no programa. Fale com seu representante de RH se precisar de ajuda para se inscrever. Atenciosamente, Delainey
UNK:UNK	Lucy, recebi seu e-mail. Não tive tempo de terminar. Vou ler neste fim de semana e perguntar ao meu pai sobre o ar condicionado. Estou feliz que você esteja gostando do trabalho. Esse final de semana vou marcar o contrato de locação e as regras. Se eu não mencionei isso quando estive lá, o dia 4 é um feriado remunerado para você e Wade. Tenha um bom fim de semana e falarei com você na próxima semana. Filipe
